{
  "address": "0x26559BdA3c4012C47C10Ba0e1D0e46405D94adE8",
  "abi": [
    {
      "anonymous": false,
      "inputs": [
        {
          "indexed": true,
          "internalType": "address",
          "name": "previousOwner",
          "type": "address"
        },
        {
          "indexed": true,
          "internalType": "address",
          "name": "newOwner",
          "type": "address"
        }
      ],
      "name": "OwnershipTransferred",
      "type": "event"
    },
    {
      "anonymous": false,
      "inputs": [
        {
          "indexed": false,
          "internalType": "uint256",
          "name": "timelockEndBlock",
          "type": "uint256"
        }
      ],
      "name": "TimelockStarted",
      "type": "event"
    },
    {
      "inputs": [],
      "name": "LPProfitShare",
      "outputs": [
        {
          "internalType": "uint256",
          "name": "",
          "type": "uint256"
        }
      ],
      "stateMutability": "view",
      "type": "function"
    },
    {
      "inputs": [],
      "name": "LPRewardsContract",
      "outputs": [
        {
          "internalType": "address",
          "name": "",
          "type": "address"
        }
      ],
      "stateMutability": "view",
      "type": "function"
    },
    {
      "inputs": [],
      "name": "daoWallet",
      "outputs": [
        {
          "internalType": "address",
          "name": "",
          "type": "address"
        }
      ],
      "stateMutability": "view",
      "type": "function"
    },
    {
      "inputs": [
        {
          "internalType": "uint256",
          "name": "depositAmount_",
          "type": "uint256"
        }
      ],
      "name": "depositPrinciple",
      "outputs": [
        {
          "internalType": "bool",
          "name": "",
          "type": "bool"
        }
      ],
      "stateMutability": "nonpayable",
      "type": "function"
    },
    {
      "inputs": [
        {
          "internalType": "uint256",
          "name": "amount_",
          "type": "uint256"
        }
      ],
      "name": "depositReserves",
      "outputs": [
        {
          "internalType": "bool",
          "name": "",
          "type": "bool"
        }
      ],
      "stateMutability": "nonpayable",
      "type": "function"
    },
    {
      "inputs": [],
      "name": "getBondingCalculator",
      "outputs": [
        {
          "internalType": "address",
          "name": "",
          "type": "address"
        }
      ],
      "stateMutability": "view",
      "type": "function"
    },
    {
      "inputs": [],
      "name": "getManagedToken",
      "outputs": [
        {
          "internalType": "address",
          "name": "",
          "type": "address"
        }
      ],
      "stateMutability": "view",
      "type": "function"
    },
    {
      "inputs": [],
      "name": "getPrincipleToken",
      "outputs": [
        {
          "internalType": "address",
          "name": "",
          "type": "address"
        }
      ],
      "stateMutability": "view",
      "type": "function"
    },
    {
      "inputs": [],
      "name": "getPrincipleTokenBalance",
      "outputs": [
        {
          "internalType": "uint256",
          "name": "",
          "type": "uint256"
        }
      ],
      "stateMutability": "view",
      "type": "function"
    },
    {
      "inputs": [],
      "name": "getReserveToken",
      "outputs": [
        {
          "internalType": "address",
          "name": "",
          "type": "address"
        }
      ],
      "stateMutability": "view",
      "type": "function"
    },
    {
      "inputs": [],
      "name": "getTimelockEndBlock",
      "outputs": [
        {
          "internalType": "uint256",
          "name": "",
          "type": "uint256"
        }
      ],
      "stateMutability": "view",
      "type": "function"
    },
    {
      "inputs": [
        {
          "internalType": "address",
          "name": "newManagedToken_",
          "type": "address"
        },
        {
          "internalType": "address",
          "name": "newReserveToken_",
          "type": "address"
        },
        {
          "internalType": "address",
          "name": "newBondingCalculator_",
          "type": "address"
        },
        {
          "internalType": "address",
          "name": "newLPRewardsContract_",
          "type": "address"
        }
      ],
      "name": "initialize",
      "outputs": [
        {
          "internalType": "bool",
          "name": "",
          "type": "bool"
        }
      ],
      "stateMutability": "nonpayable",
      "type": "function"
    },
    {
      "inputs": [],
      "name": "isInitialized",
      "outputs": [
        {
          "internalType": "bool",
          "name": "",
          "type": "bool"
        }
      ],
      "stateMutability": "view",
      "type": "function"
    },
    {
      "inputs": [
        {
          "internalType": "address",
          "name": "",
          "type": "address"
        }
      ],
      "name": "isPrincipleDepositor",
      "outputs": [
        {
          "internalType": "bool",
          "name": "",
          "type": "bool"
        }
      ],
      "stateMutability": "view",
      "type": "function"
    },
    {
      "inputs": [
        {
          "internalType": "address",
          "name": "",
          "type": "address"
        }
      ],
      "name": "isPrincipleToken",
      "outputs": [
        {
          "internalType": "bool",
          "name": "",
          "type": "bool"
        }
      ],
      "stateMutability": "view",
      "type": "function"
    },
    {
      "inputs": [
        {
          "internalType": "address",
          "name": "",
          "type": "address"
        }
      ],
      "name": "isReserveDepositor",
      "outputs": [
        {
          "internalType": "bool",
          "name": "",
          "type": "bool"
        }
      ],
      "stateMutability": "view",
      "type": "function"
    },
    {
      "inputs": [
        {
          "internalType": "address",
          "name": "",
          "type": "address"
        }
      ],
      "name": "isReserveToken",
      "outputs": [
        {
          "internalType": "bool",
          "name": "",
          "type": "bool"
        }
      ],
      "stateMutability": "view",
      "type": "function"
    },
    {
      "inputs": [],
      "name": "isTimelockSet",
      "outputs": [
        {
          "internalType": "bool",
          "name": "",
          "type": "bool"
        }
      ],
      "stateMutability": "view",
      "type": "function"
    },
    {
      "inputs": [],
      "name": "migrateReserveAndPrinciple",
      "outputs": [
        {
          "internalType": "bool",
          "name": "saveGas_",
          "type": "bool"
        }
      ],
      "stateMutability": "nonpayable",
      "type": "function"
    },
    {
      "inputs": [],
      "name": "owner",
      "outputs": [
        {
          "internalType": "address",
          "name": "",
          "type": "address"
        }
      ],
      "stateMutability": "view",
      "type": "function"
    },
    {
      "inputs": [
        {
          "internalType": "address",
          "name": "depositor_",
          "type": "address"
        }
      ],
      "name": "removePrincipleDepositor",
      "outputs": [
        {
          "internalType": "bool",
          "name": "",
          "type": "bool"
        }
      ],
      "stateMutability": "nonpayable",
      "type": "function"
    },
    {
      "inputs": [
        {
          "internalType": "address",
          "name": "depositor_",
          "type": "address"
        }
      ],
      "name": "removeReserveDepositor",
      "outputs": [
        {
          "internalType": "bool",
          "name": "",
          "type": "bool"
        }
      ],
      "stateMutability": "nonpayable",
      "type": "function"
    },
    {
      "inputs": [],
      "name": "renounceOwnership",
      "outputs": [],
      "stateMutability": "nonpayable",
      "type": "function"
    },
    {
      "inputs": [
        {
          "internalType": "uint256",
          "name": "depositAmount_",
          "type": "uint256"
        }
      ],
      "name": "rewardsDepositPrinciple",
      "outputs": [
        {
          "internalType": "bool",
          "name": "",
          "type": "bool"
        }
      ],
      "stateMutability": "nonpayable",
      "type": "function"
    },
    {
      "inputs": [
        {
          "internalType": "address",
          "name": "newDAOWallet_",
          "type": "address"
        }
      ],
      "name": "setDAOWallet",
      "outputs": [
        {
          "internalType": "bool",
          "name": "",
          "type": "bool"
        }
      ],
      "stateMutability": "nonpayable",
      "type": "function"
    },
    {
      "inputs": [
        {
          "internalType": "uint256",
          "name": "newLPProfitShare_",
          "type": "uint256"
        }
      ],
      "name": "setLPProfitShare",
      "outputs": [
        {
          "internalType": "bool",
          "name": "",
          "type": "bool"
        }
      ],
      "stateMutability": "nonpayable",
      "type": "function"
    },
    {
      "inputs": [
        {
          "internalType": "address",
          "name": "newLPRewardsContract_",
          "type": "address"
        }
      ],
      "name": "setLPRewardsContract",
      "outputs": [
        {
          "internalType": "bool",
          "name": "",
          "type": "bool"
        }
      ],
      "stateMutability": "nonpayable",
      "type": "function"
    },
    {
      "inputs": [
        {
          "internalType": "address",
          "name": "newDepositor_",
          "type": "address"
        }
      ],
      "name": "setPrincipleDepositor",
      "outputs": [
        {
          "internalType": "bool",
          "name": "",
          "type": "bool"
        }
      ],
      "stateMutability": "nonpayable",
      "type": "function"
    },
    {
      "inputs": [
        {
          "internalType": "address",
          "name": "newPrincipleToken_",
          "type": "address"
        }
      ],
      "name": "setPrincipleToken",
      "outputs": [
        {
          "internalType": "bool",
          "name": "",
          "type": "bool"
        }
      ],
      "stateMutability": "nonpayable",
      "type": "function"
    },
    {
      "inputs": [
        {
          "internalType": "address",
          "name": "newDepositor_",
          "type": "address"
        }
      ],
      "name": "setReserveDepositor",
      "outputs": [
        {
          "internalType": "bool",
          "name": "",
          "type": "bool"
        }
      ],
      "stateMutability": "nonpayable",
      "type": "function"
    },
    {
      "inputs": [
        {
          "internalType": "address",
          "name": "newStakingContract_",
          "type": "address"
        }
      ],
      "name": "setStakingContract",
      "outputs": [
        {
          "internalType": "bool",
          "name": "",
          "type": "bool"
        }
      ],
      "stateMutability": "nonpayable",
      "type": "function"
    },
    {
      "inputs": [
        {
          "internalType": "uint256",
          "name": "newTimelockDurationInBlocks_",
          "type": "uint256"
        }
      ],
      "name": "setTimelock",
      "outputs": [
        {
          "internalType": "bool",
          "name": "",
          "type": "bool"
        }
      ],
      "stateMutability": "nonpayable",
      "type": "function"
    },
    {
      "inputs": [],
      "name": "stakingContract",
      "outputs": [
        {
          "internalType": "address",
          "name": "",
          "type": "address"
        }
      ],
      "stateMutability": "view",
      "type": "function"
    },
    {
      "inputs": [],
      "name": "startTimelock",
      "outputs": [
        {
          "internalType": "bool",
          "name": "",
          "type": "bool"
        }
      ],
      "stateMutability": "nonpayable",
      "type": "function"
    },
    {
      "inputs": [],
      "name": "timelockDurationInBlocks",
      "outputs": [
        {
          "internalType": "uint256",
          "name": "",
          "type": "uint256"
        }
      ],
      "stateMutability": "view",
      "type": "function"
    },
    {
      "inputs": [
        {
          "internalType": "address",
          "name": "newOwner_",
          "type": "address"
        }
      ],
      "name": "transferOwnership",
      "outputs": [],
      "stateMutability": "nonpayable",
      "type": "function"
    }
  ],
  "transactionHash": "0xb7cb770051c44d9443fdd9a0c55fa56a0402ae3845f511312cad27a21c2ffdcf",
  "receipt": {
    "to": null,
    "from": "0x745120412F4397300e9F459a50a430C66281fb0E",
    "contractAddress": "0x26559BdA3c4012C47C10Ba0e1D0e46405D94adE8",
    "transactionIndex": 1,
    "gasUsed": "1523674",
    "logsBloom": "0x00000000000000000000000000000000000000000000000000800000000000000000000000000000000000000000000000000000000000000000000000000000000000000000000000000000000100000001000000000000000000000000000000000000020000000000000000000800000000000000000000000000010000400000000000000000000000008000000000000000000000000000000000000000000000000000000000000000000000000000000000000000000000000000000000000000000008000000000000000000000000000000000000000000000020000000000000000000000000000000000000004000000000001000000000000000",
    "blockHash": "0xce7b23fe76ea2c64a06286ca76ed6c09972c804266e6af6c01cdc3094b1338a3",
    "transactionHash": "0xb7cb770051c44d9443fdd9a0c55fa56a0402ae3845f511312cad27a21c2ffdcf",
    "logs": [
      {
        "transactionIndex": 1,
        "blockNumber": 8478110,
        "transactionHash": "0xb7cb770051c44d9443fdd9a0c55fa56a0402ae3845f511312cad27a21c2ffdcf",
        "address": "0x26559BdA3c4012C47C10Ba0e1D0e46405D94adE8",
        "topics": [
          "0x8be0079c531659141344cd1fd0a4f28419497f9722a3daafe3b4186f6b6457e0",
          "0x0000000000000000000000000000000000000000000000000000000000000000",
          "0x000000000000000000000000745120412f4397300e9f459a50a430c66281fb0e"
        ],
        "data": "0x",
        "logIndex": 5,
        "blockHash": "0xce7b23fe76ea2c64a06286ca76ed6c09972c804266e6af6c01cdc3094b1338a3"
      }
    ],
    "blockNumber": 8478110,
    "cumulativeGasUsed": "2037889",
    "status": 1,
    "byzantium": true
  },
  "args": [],
  "solcInputHash": "73cf82a18c47f9079231c06556300d2c",
  "metadata": "{\"compiler\":{\"version\":\"0.7.5+commit.eb77ed08\"},\"language\":\"Solidity\",\"output\":{\"abi\":[{\"anonymous\":false,\"inputs\":[{\"indexed\":true,\"internalType\":\"address\",\"name\":\"previousOwner\",\"type\":\"address\"},{\"indexed\":true,\"internalType\":\"address\",\"name\":\"newOwner\",\"type\":\"address\"}],\"name\":\"OwnershipTransferred\",\"type\":\"event\"},{\"anonymous\":false,\"inputs\":[{\"indexed\":false,\"internalType\":\"uint256\",\"name\":\"timelockEndBlock\",\"type\":\"uint256\"}],\"name\":\"TimelockStarted\",\"type\":\"event\"},{\"inputs\":[],\"name\":\"LPProfitShare\",\"outputs\":[{\"internalType\":\"uint256\",\"name\":\"\",\"type\":\"uint256\"}],\"stateMutability\":\"view\",\"type\":\"function\"},{\"inputs\":[],\"name\":\"LPRewardsContract\",\"outputs\":[{\"internalType\":\"address\",\"name\":\"\",\"type\":\"address\"}],\"stateMutability\":\"view\",\"type\":\"function\"},{\"inputs\":[],\"name\":\"daoWallet\",\"outputs\":[{\"internalType\":\"address\",\"name\":\"\",\"type\":\"address\"}],\"stateMutability\":\"view\",\"type\":\"function\"},{\"inputs\":[{\"internalType\":\"uint256\",\"name\":\"depositAmount_\",\"type\":\"uint256\"}],\"name\":\"depositPrinciple\",\"outputs\":[{\"internalType\":\"bool\",\"name\":\"\",\"type\":\"bool\"}],\"stateMutability\":\"nonpayable\",\"type\":\"function\"},{\"inputs\":[{\"internalType\":\"uint256\",\"name\":\"amount_\",\"type\":\"uint256\"}],\"name\":\"depositReserves\",\"outputs\":[{\"internalType\":\"bool\",\"name\":\"\",\"type\":\"bool\"}],\"stateMutability\":\"nonpayable\",\"type\":\"function\"},{\"inputs\":[],\"name\":\"getBondingCalculator\",\"outputs\":[{\"internalType\":\"address\",\"name\":\"\",\"type\":\"address\"}],\"stateMutability\":\"view\",\"type\":\"function\"},{\"inputs\":[],\"name\":\"getManagedToken\",\"outputs\":[{\"internalType\":\"address\",\"name\":\"\",\"type\":\"address\"}],\"stateMutability\":\"view\",\"type\":\"function\"},{\"inputs\":[],\"name\":\"getPrincipleToken\",\"outputs\":[{\"internalType\":\"address\",\"name\":\"\",\"type\":\"address\"}],\"stateMutability\":\"view\",\"type\":\"function\"},{\"inputs\":[],\"name\":\"getPrincipleTokenBalance\",\"outputs\":[{\"internalType\":\"uint256\",\"name\":\"\",\"type\":\"uint256\"}],\"stateMutability\":\"view\",\"type\":\"function\"},{\"inputs\":[],\"name\":\"getReserveToken\",\"outputs\":[{\"internalType\":\"address\",\"name\":\"\",\"type\":\"address\"}],\"stateMutability\":\"view\",\"type\":\"function\"},{\"inputs\":[],\"name\":\"getTimelockEndBlock\",\"outputs\":[{\"internalType\":\"uint256\",\"name\":\"\",\"type\":\"uint256\"}],\"stateMutability\":\"view\",\"type\":\"function\"},{\"inputs\":[{\"internalType\":\"address\",\"name\":\"newManagedToken_\",\"type\":\"address\"},{\"internalType\":\"address\",\"name\":\"newReserveToken_\",\"type\":\"address\"},{\"internalType\":\"address\",\"name\":\"newBondingCalculator_\",\"type\":\"address\"},{\"internalType\":\"address\",\"name\":\"newLPRewardsContract_\",\"type\":\"address\"}],\"name\":\"initialize\",\"outputs\":[{\"internalType\":\"bool\",\"name\":\"\",\"type\":\"bool\"}],\"stateMutability\":\"nonpayable\",\"type\":\"function\"},{\"inputs\":[],\"name\":\"isInitialized\",\"outputs\":[{\"internalType\":\"bool\",\"name\":\"\",\"type\":\"bool\"}],\"stateMutability\":\"view\",\"type\":\"function\"},{\"inputs\":[{\"internalType\":\"address\",\"name\":\"\",\"type\":\"address\"}],\"name\":\"isPrincipleDepositor\",\"outputs\":[{\"internalType\":\"bool\",\"name\":\"\",\"type\":\"bool\"}],\"stateMutability\":\"view\",\"type\":\"function\"},{\"inputs\":[{\"internalType\":\"address\",\"name\":\"\",\"type\":\"address\"}],\"name\":\"isPrincipleToken\",\"outputs\":[{\"internalType\":\"bool\",\"name\":\"\",\"type\":\"bool\"}],\"stateMutability\":\"view\",\"type\":\"function\"},{\"inputs\":[{\"internalType\":\"address\",\"name\":\"\",\"type\":\"address\"}],\"name\":\"isReserveDepositor\",\"outputs\":[{\"internalType\":\"bool\",\"name\":\"\",\"type\":\"bool\"}],\"stateMutability\":\"view\",\"type\":\"function\"},{\"inputs\":[{\"internalType\":\"address\",\"name\":\"\",\"type\":\"address\"}],\"name\":\"isReserveToken\",\"outputs\":[{\"internalType\":\"bool\",\"name\":\"\",\"type\":\"bool\"}],\"stateMutability\":\"view\",\"type\":\"function\"},{\"inputs\":[],\"name\":\"isTimelockSet\",\"outputs\":[{\"internalType\":\"bool\",\"name\":\"\",\"type\":\"bool\"}],\"stateMutability\":\"view\",\"type\":\"function\"},{\"inputs\":[],\"name\":\"migrateReserveAndPrinciple\",\"outputs\":[{\"internalType\":\"bool\",\"name\":\"saveGas_\",\"type\":\"bool\"}],\"stateMutability\":\"nonpayable\",\"type\":\"function\"},{\"inputs\":[],\"name\":\"owner\",\"outputs\":[{\"internalType\":\"address\",\"name\":\"\",\"type\":\"address\"}],\"stateMutability\":\"view\",\"type\":\"function\"},{\"inputs\":[{\"internalType\":\"address\",\"name\":\"depositor_\",\"type\":\"address\"}],\"name\":\"removePrincipleDepositor\",\"outputs\":[{\"internalType\":\"bool\",\"name\":\"\",\"type\":\"bool\"}],\"stateMutability\":\"nonpayable\",\"type\":\"function\"},{\"inputs\":[{\"internalType\":\"address\",\"name\":\"depositor_\",\"type\":\"address\"}],\"name\":\"removeReserveDepositor\",\"outputs\":[{\"internalType\":\"bool\",\"name\":\"\",\"type\":\"bool\"}],\"stateMutability\":\"nonpayable\",\"type\":\"function\"},{\"inputs\":[],\"name\":\"renounceOwnership\",\"outputs\":[],\"stateMutability\":\"nonpayable\",\"type\":\"function\"},{\"inputs\":[{\"internalType\":\"uint256\",\"name\":\"depositAmount_\",\"type\":\"uint256\"}],\"name\":\"rewardsDepositPrinciple\",\"outputs\":[{\"internalType\":\"bool\",\"name\":\"\",\"type\":\"bool\"}],\"stateMutability\":\"nonpayable\",\"type\":\"function\"},{\"inputs\":[{\"internalType\":\"address\",\"name\":\"newDAOWallet_\",\"type\":\"address\"}],\"name\":\"setDAOWallet\",\"outputs\":[{\"internalType\":\"bool\",\"name\":\"\",\"type\":\"bool\"}],\"stateMutability\":\"nonpayable\",\"type\":\"function\"},{\"inputs\":[{\"internalType\":\"uint256\",\"name\":\"newLPProfitShare_\",\"type\":\"uint256\"}],\"name\":\"setLPProfitShare\",\"outputs\":[{\"internalType\":\"bool\",\"name\":\"\",\"type\":\"bool\"}],\"stateMutability\":\"nonpayable\",\"type\":\"function\"},{\"inputs\":[{\"internalType\":\"address\",\"name\":\"newLPRewardsContract_\",\"type\":\"address\"}],\"name\":\"setLPRewardsContract\",\"outputs\":[{\"internalType\":\"bool\",\"name\":\"\",\"type\":\"bool\"}],\"stateMutability\":\"nonpayable\",\"type\":\"function\"},{\"inputs\":[{\"internalType\":\"address\",\"name\":\"newDepositor_\",\"type\":\"address\"}],\"name\":\"setPrincipleDepositor\",\"outputs\":[{\"internalType\":\"bool\",\"name\":\"\",\"type\":\"bool\"}],\"stateMutability\":\"nonpayable\",\"type\":\"function\"},{\"inputs\":[{\"internalType\":\"address\",\"name\":\"newPrincipleToken_\",\"type\":\"address\"}],\"name\":\"setPrincipleToken\",\"outputs\":[{\"internalType\":\"bool\",\"name\":\"\",\"type\":\"bool\"}],\"stateMutability\":\"nonpayable\",\"type\":\"function\"},{\"inputs\":[{\"internalType\":\"address\",\"name\":\"newDepositor_\",\"type\":\"address\"}],\"name\":\"setReserveDepositor\",\"outputs\":[{\"internalType\":\"bool\",\"name\":\"\",\"type\":\"bool\"}],\"stateMutability\":\"nonpayable\",\"type\":\"function\"},{\"inputs\":[{\"internalType\":\"address\",\"name\":\"newStakingContract_\",\"type\":\"address\"}],\"name\":\"setStakingContract\",\"outputs\":[{\"internalType\":\"bool\",\"name\":\"\",\"type\":\"bool\"}],\"stateMutability\":\"nonpayable\",\"type\":\"function\"},{\"inputs\":[{\"internalType\":\"uint256\",\"name\":\"newTimelockDurationInBlocks_\",\"type\":\"uint256\"}],\"name\":\"setTimelock\",\"outputs\":[{\"internalType\":\"bool\",\"name\":\"\",\"type\":\"bool\"}],\"stateMutability\":\"nonpayable\",\"type\":\"function\"},{\"inputs\":[],\"name\":\"stakingContract\",\"outputs\":[{\"internalType\":\"address\",\"name\":\"\",\"type\":\"address\"}],\"stateMutability\":\"view\",\"type\":\"function\"},{\"inputs\":[],\"name\":\"startTimelock\",\"outputs\":[{\"internalType\":\"bool\",\"name\":\"\",\"type\":\"bool\"}],\"stateMutability\":\"nonpayable\",\"type\":\"function\"},{\"inputs\":[],\"name\":\"timelockDurationInBlocks\",\"outputs\":[{\"internalType\":\"uint256\",\"name\":\"\",\"type\":\"uint256\"}],\"stateMutability\":\"view\",\"type\":\"function\"},{\"inputs\":[{\"internalType\":\"address\",\"name\":\"newOwner_\",\"type\":\"address\"}],\"name\":\"transferOwnership\",\"outputs\":[],\"stateMutability\":\"nonpayable\",\"type\":\"function\"}],\"devdoc\":{\"kind\":\"dev\",\"methods\":{},\"version\":1},\"userdoc\":{\"kind\":\"user\",\"methods\":{},\"version\":1}},\"settings\":{\"compilationTarget\":{\"contracts/Vault.sol\":\"Vault\"},\"evmVersion\":\"istanbul\",\"libraries\":{},\"metadata\":{\"bytecodeHash\":\"ipfs\",\"useLiteralContent\":true},\"optimizer\":{\"enabled\":true,\"runs\":200},\"remappings\":[]},\"sources\":{\"contracts/Vault.sol\":{\"content\":\"// SPDX-License-Identifier: AGPL-3.0-or-later\\r\\npragma solidity 0.7.5;\\r\\n\\r\\ninterface IOwnable {\\r\\n\\r\\n  function owner() external view returns (address);\\r\\n\\r\\n  function renounceOwnership() external;\\r\\n\\r\\n  function transferOwnership( address newOwner_ ) external;\\r\\n}\\r\\n\\r\\nlibrary SafeMath {\\r\\n\\r\\n    function add(uint256 a, uint256 b) internal pure returns (uint256) {\\r\\n        uint256 c = a + b;\\r\\n        require(c >= a, \\\"SafeMath: addition overflow\\\");\\r\\n\\r\\n        return c;\\r\\n    }\\r\\n\\r\\n    function sub(uint256 a, uint256 b) internal pure returns (uint256) {\\r\\n        return sub(a, b, \\\"SafeMath: subtraction overflow\\\");\\r\\n    }\\r\\n\\r\\n    function sub(uint256 a, uint256 b, string memory errorMessage) internal pure returns (uint256) {\\r\\n        require(b <= a, errorMessage);\\r\\n        uint256 c = a - b;\\r\\n\\r\\n        return c;\\r\\n    }\\r\\n\\r\\n    function mul(uint256 a, uint256 b) internal pure returns (uint256) {\\r\\n        if (a == 0) {\\r\\n            return 0;\\r\\n        }\\r\\n\\r\\n        uint256 c = a * b;\\r\\n        require(c / a == b, \\\"SafeMath: multiplication overflow\\\");\\r\\n\\r\\n        return c;\\r\\n    }\\r\\n\\r\\n    function div(uint256 a, uint256 b) internal pure returns (uint256) {\\r\\n        return div(a, b, \\\"SafeMath: division by zero\\\");\\r\\n    }\\r\\n\\r\\n    function div(uint256 a, uint256 b, string memory errorMessage) internal pure returns (uint256) {\\r\\n        require(b > 0, errorMessage);\\r\\n        uint256 c = a / b;\\r\\n        return c;\\r\\n    }\\r\\n\\r\\n    function mod(uint256 a, uint256 b) internal pure returns (uint256) {\\r\\n        return mod(a, b, \\\"SafeMath: modulo by zero\\\");\\r\\n    }\\r\\n\\r\\n    function mod(uint256 a, uint256 b, string memory errorMessage) internal pure returns (uint256) {\\r\\n        require(b != 0, errorMessage);\\r\\n        return a % b;\\r\\n    }\\r\\n\\r\\n}\\r\\n\\r\\nlibrary SafeMathInt {\\r\\n\\r\\n    function sub(int256 a, int256 b)\\r\\n        internal\\r\\n        pure\\r\\n        returns (int256)\\r\\n    {\\r\\n        int256 c = a - b;\\r\\n        require((b >= 0 && c <= a) || (b < 0 && c > a));\\r\\n        return c;\\r\\n    }\\r\\n\\r\\n    function add(int256 a, int256 b)\\r\\n        internal\\r\\n        pure\\r\\n        returns (int256)\\r\\n    {\\r\\n        int256 c = a + b;\\r\\n        require((b >= 0 && c >= a) || (b < 0 && c < a));\\r\\n        return c;\\r\\n    }\\r\\n}\\r\\n\\r\\ninterface IBondingCalculator {\\r\\n\\r\\n  function calcDebtRatio( uint pendingDebtDue_, uint managedTokenTotalSupply_ ) external pure returns ( uint debtRatio_ );\\r\\n\\r\\n  function calcBondPremium( uint debtRatio_, uint bondScalingFactor ) external pure returns ( uint premium_ );\\r\\n\\r\\n  function calcPrincipleValuation( uint k_, uint amountDeposited_, uint totalSupplyOfTokenDeposited_ ) external pure returns ( uint principleValuation_ );\\r\\n\\r\\n  function principleValuation( address principleTokenAddress_, uint amountDeposited_ ) external view returns ( uint principleValuation_ );\\r\\n\\r\\n  function calculateBondInterest( address treasury_, address principleTokenAddress_, uint amountDeposited_, uint bondScalingFactor ) external returns ( uint interestDue_ );\\r\\n}\\r\\n/**\\r\\ninterface IPrincipleDepository {\\r\\n\\r\\n  function getCurrentBondTerm() external returns ( uint, uint );\\r\\n\\r\\n  function treasury() external returns ( address );\\r\\n\\r\\n  function getBondCalculator() external returns ( address );\\r\\n\\r\\n  function isPrincipleToken( address ) external returns ( bool );\\r\\n\\r\\n  function getDepositorInfoForDepositor( address ) external returns ( uint, uint, uint );\\r\\n\\r\\n  function addPrincipleToken( address newPrincipleToken_ ) external returns ( bool );\\r\\n\\r\\n  function setTreasury( address newTreasury_ ) external returns ( bool );\\r\\n\\r\\n  function addBondTerm( address bondPrincipleToken_, uint256 bondScalingFactor_, uint256 bondingPeriodInBlocks_ ) external returns ( bool );\\r\\n\\r\\n  function getDepositorInfo( address depositorAddress_) external view returns ( uint principleAmount_, uint interestDue_, uint bondMaturationBlock_);\\r\\n\\r\\n  function depositBondPrinciple( address bondPrincipleTokenToDeposit_, uint256 amountToDeposit_ ) external returns ( bool );\\r\\n\\r\\n  function depositBondPrincipleWithPermit( address bondPrincipleTokenToDeposit_, uint256 amountToDeposit_, uint256 deadline, uint8 v, bytes32 r, bytes32 s ) external returns ( bool );\\r\\n\\r\\n  function withdrawPrincipleAndForfeitInterest( address bondPrincipleToWithdraw_ ) external returns ( bool );\\r\\n\\r\\n  function redeemBond(address bondPrincipleToRedeem_ ) external returns ( bool );\\r\\n}\\r\\n*/\\r\\ninterface ITreasury {\\r\\n  function getBondingCalculator() external returns ( address );\\r\\n  // function payDebt( address depositor_ ) external returns ( bool );\\r\\n  function getTimelockEndBlock() external returns ( uint );\\r\\n  function getManagedToken() external returns ( address );\\r\\n  // function getDebtAmountDue() external returns ( uint );\\r\\n  // function incurDebt( uint principieTokenAmountDeposited_, uint bondScalingValue_ ) external returns ( bool );\\r\\n}\\r\\n\\r\\nlibrary Address {\\r\\n\\r\\n  function isContract(address account) internal view returns (bool) {\\r\\n        // This method relies in extcodesize, which returns 0 for contracts in\\r\\n        // construction, since the code is only stored at the end of the\\r\\n        // constructor execution.\\r\\n\\r\\n        uint256 size;\\r\\n        // solhint-disable-next-line no-inline-assembly\\r\\n        assembly { size := extcodesize(account) }\\r\\n        return size > 0;\\r\\n    }\\r\\n\\r\\n    function functionCall(address target, bytes memory data, string memory errorMessage) internal returns (bytes memory) {\\r\\n        return _functionCallWithValue(target, data, 0, errorMessage);\\r\\n    }\\r\\n\\r\\n    function _functionCallWithValue(address target, bytes memory data, uint256 weiValue, string memory errorMessage) private returns (bytes memory) {\\r\\n        require(isContract(target), \\\"Address: call to non-contract\\\");\\r\\n\\r\\n        // solhint-disable-next-line avoid-low-level-calls\\r\\n        (bool success, bytes memory returndata) = target.call{ value: weiValue }(data);\\r\\n        if (success) {\\r\\n            return returndata;\\r\\n        } else {\\r\\n            if (returndata.length > 0) {\\r\\n                // solhint-disable-next-line no-inline-assembly\\r\\n                assembly {\\r\\n                    let returndata_size := mload(returndata)\\r\\n                    revert(add(32, returndata), returndata_size)\\r\\n                }\\r\\n            } else {\\r\\n                revert(errorMessage);\\r\\n            }\\r\\n        }\\r\\n    }\\r\\n\\r\\n    function _verifyCallResult(bool success, bytes memory returndata, string memory errorMessage) private pure returns(bytes memory) {\\r\\n        if (success) {\\r\\n            return returndata;\\r\\n        } else {\\r\\n            if (returndata.length > 0) {\\r\\n                // solhint-disable-next-line no-inline-assembly\\r\\n                assembly {\\r\\n                    let returndata_size := mload(returndata)\\r\\n                    revert(add(32, returndata), returndata_size)\\r\\n                }\\r\\n            } else {\\r\\n                revert(errorMessage);\\r\\n            }\\r\\n        }\\r\\n    }\\r\\n}\\r\\n\\r\\ncontract Ownable is IOwnable {\\r\\n\\r\\n  address internal _owner;\\r\\n\\r\\n  event OwnershipTransferred(address indexed previousOwner, address indexed newOwner);\\r\\n\\r\\n  constructor () {\\r\\n    _owner = msg.sender;\\r\\n    emit OwnershipTransferred( address(0), _owner );\\r\\n  }\\r\\n\\r\\n  function owner() public view override returns (address) {\\r\\n    return _owner;\\r\\n  }\\r\\n\\r\\n  modifier onlyOwner() {\\r\\n    require( _owner == msg.sender, \\\"Ownable: caller is not the owner\\\" );\\r\\n    _;\\r\\n  }\\r\\n\\r\\n  function renounceOwnership() public virtual override onlyOwner() {\\r\\n    emit OwnershipTransferred( _owner, address(0) );\\r\\n    _owner = address(0);\\r\\n  }\\r\\n\\r\\n  function transferOwnership( address newOwner_ ) public virtual override onlyOwner() {\\r\\n    require( newOwner_ != address(0), \\\"Ownable: new owner is the zero address\\\");\\r\\n    emit OwnershipTransferred( _owner, newOwner_ );\\r\\n    _owner = newOwner_;\\r\\n  }\\r\\n}\\r\\n\\r\\ninterface IERC20 {\\r\\n\\r\\n  function decimals() external view returns (uint8);\\r\\n  /**\\r\\n   * @dev Returns the amount of tokens in existence.\\r\\n   */\\r\\n  function totalSupply() external view returns (uint256);\\r\\n\\r\\n  /**\\r\\n   * @dev Returns the amount of tokens owned by `account`.\\r\\n   */\\r\\n  function balanceOf(address account) external view returns (uint256);\\r\\n\\r\\n  /**\\r\\n   * @dev Moves `amount` tokens from the caller's account to `recipient`.\\r\\n   *\\r\\n   * Returns a boolean value indicating whether the operation succeeded.\\r\\n   *\\r\\n   * Emits a {Transfer} event.\\r\\n   */\\r\\n  function transfer(address recipient, uint256 amount) external returns (bool);\\r\\n\\r\\n  /**\\r\\n   * @dev Returns the remaining number of tokens that `spender` will be\\r\\n   * allowed to spend on behalf of `owner` through {transferFrom}. This is\\r\\n   * zero by default.\\r\\n   *\\r\\n   * This value changes when {approve} or {transferFrom} are called.\\r\\n   */\\r\\n  function allowance(address owner, address spender) external view returns (uint256);\\r\\n\\r\\n  /**\\r\\n   * @dev Sets `amount` as the allowance of `spender` over the caller's tokens.\\r\\n   *\\r\\n   * Returns a boolean value indicating whether the operation succeeded.\\r\\n   *\\r\\n   * IMPORTANT: Beware that changing an allowance with this method brings the risk\\r\\n   * that someone may use both the old and the new allowance by unfortunate\\r\\n   * transaction ordering. One possible solution to mitigate this race\\r\\n   * condition is to first reduce the spender's allowance to 0 and set the\\r\\n   * desired value afterwards:\\r\\n   * https://github.com/ethereum/EIPs/issues/20#issuecomment-263524729\\r\\n   *\\r\\n   * Emits an {Approval} event.\\r\\n   */\\r\\n  function approve(address spender, uint256 amount) external returns (bool);\\r\\n\\r\\n  /**\\r\\n   * @dev Moves `amount` tokens from `sender` to `recipient` using the\\r\\n   * allowance mechanism. `amount` is then deducted from the caller's\\r\\n   * allowance.\\r\\n   *\\r\\n   * Returns a boolean value indicating whether the operation succeeded.\\r\\n   *\\r\\n   * Emits a {Transfer} event.\\r\\n   */\\r\\n  function transferFrom(address sender, address recipient, uint256 amount) external returns (bool);\\r\\n\\r\\n  /**\\r\\n   * @dev Emitted when `value` tokens are moved from one account (`from`) to\\r\\n   * another (`to`).\\r\\n   *\\r\\n   * Note that `value` may be zero.\\r\\n   */\\r\\n  event Transfer(address indexed from, address indexed to, uint256 value);\\r\\n\\r\\n  /**\\r\\n   * @dev Emitted when the allowance of a `spender` for an `owner` is set by\\r\\n   * a call to {approve}. `value` is the new allowance.\\r\\n   */\\r\\n  event Approval(address indexed owner, address indexed spender, uint256 value);\\r\\n}\\r\\n\\r\\nlibrary SafeERC20 {\\r\\n    using SafeMath for uint256;\\r\\n    using Address for address;\\r\\n\\r\\n    function safeTransfer(IERC20 token, address to, uint256 value) internal {\\r\\n        _callOptionalReturn(token, abi.encodeWithSelector(token.transfer.selector, to, value));\\r\\n    }\\r\\n\\r\\n    function safeTransferFrom(IERC20 token, address from, address to, uint256 value) internal {\\r\\n        _callOptionalReturn(token, abi.encodeWithSelector(token.transferFrom.selector, from, to, value));\\r\\n    }\\r\\n\\r\\n    function _callOptionalReturn(IERC20 token, bytes memory data) private {\\r\\n        bytes memory returndata = address(token).functionCall(data, \\\"SafeERC20: low-level call failed\\\");\\r\\n        if (returndata.length > 0) { // Return data is optional\\r\\n            // solhint-disable-next-line max-line-length\\r\\n            require(abi.decode(returndata, (bool)), \\\"SafeERC20: ERC20 operation did not succeed\\\");\\r\\n        }\\r\\n    }\\r\\n}\\r\\ninterface IERC20Mintable {\\r\\n\\r\\n  function mint( uint256 amount_ ) external;\\r\\n\\r\\n  function mint( address account_, uint256 ammount_ ) external;\\r\\n}\\r\\n\\r\\ncontract Vault is ITreasury, Ownable {\\r\\n\\r\\n  using SafeMath for uint;\\r\\n  using SafeMathInt for int;\\r\\n  using SafeERC20 for IERC20;\\r\\n\\r\\n  event TimelockStarted( uint timelockEndBlock );\\r\\n\\r\\n  bool public isInitialized;\\r\\n\\r\\n  uint public timelockDurationInBlocks;\\r\\n  bool public isTimelockSet;\\r\\n  uint public override getTimelockEndBlock;\\r\\n\\r\\n  address public daoWallet;\\r\\n  address public LPRewardsContract;\\r\\n  address public stakingContract;\\r\\n\\r\\n  uint public LPProfitShare;\\r\\n\\r\\n  uint public getPrincipleTokenBalance;\\r\\n\\r\\n  address public override getManagedToken;\\r\\n  address public getReserveToken;\\r\\n  address public getPrincipleToken;\\r\\n\\r\\n  address public override getBondingCalculator;\\r\\n\\r\\n  mapping( address => bool ) public isReserveToken;\\r\\n\\r\\n  mapping( address => bool ) public isPrincipleToken;\\r\\n\\r\\n  mapping( address => bool ) public isPrincipleDepositor;\\r\\n\\r\\n  mapping( address => bool ) public isReserveDepositor;\\r\\n\\r\\n  modifier notInitialized() {\\r\\n    require( !isInitialized );\\r\\n    _;\\r\\n  }\\r\\n\\r\\n  modifier onlyReserveToken( address reserveTokenChallenge_ ) {\\r\\n    require( isReserveToken[reserveTokenChallenge_] == true, \\\"Vault: reserveTokenChallenge_ is not a reserve Token.\\\" );\\r\\n    _;\\r\\n  }\\r\\n\\r\\n  modifier onlyPrincipleToken( address PrincipleTokenChallenge_ ) {\\r\\n    require( isPrincipleToken[PrincipleTokenChallenge_] == true, \\\"Vault: PrincipleTokenChallenge_ is not a Principle token.\\\" );\\r\\n    _;\\r\\n  }\\r\\n\\r\\n  modifier notTimelockSet() {\\r\\n    require( !isTimelockSet );\\r\\n    _;\\r\\n  }\\r\\n\\r\\n  modifier isTimelockExpired() {\\r\\n    require( getTimelockEndBlock != 0 );\\r\\n    require( isTimelockSet );\\r\\n    require( block.number >= getTimelockEndBlock );\\r\\n    _;\\r\\n  }\\r\\n\\r\\n  modifier isTimelockStarted() {\\r\\n    if( getTimelockEndBlock != 0 ) {\\r\\n      emit TimelockStarted( getTimelockEndBlock );\\r\\n    }\\r\\n    _;\\r\\n  }\\r\\n\\r\\n  function setDAOWallet( address newDAOWallet_ ) external onlyOwner() returns ( bool ) {\\r\\n    daoWallet = newDAOWallet_;\\r\\n    return true;\\r\\n  }\\r\\n\\r\\n  function setStakingContract( address newStakingContract_ ) external onlyOwner() returns ( bool ) {\\r\\n    stakingContract = newStakingContract_;\\r\\n    return true;\\r\\n  }\\r\\n\\r\\n  function setLPRewardsContract( address newLPRewardsContract_ ) external onlyOwner() returns ( bool ) {\\r\\n    LPRewardsContract = newLPRewardsContract_;\\r\\n    return true;\\r\\n  }\\r\\n\\r\\n  function setLPProfitShare( uint newLPProfitShare_ ) external onlyOwner() returns ( bool ) {\\r\\n    LPProfitShare = newLPProfitShare_;\\r\\n    return true;\\r\\n  }\\r\\n\\r\\n  function initialize(\\r\\n    address newManagedToken_,\\r\\n    address newReserveToken_,\\r\\n    address newBondingCalculator_,\\r\\n    address newLPRewardsContract_\\r\\n  ) external onlyOwner() notInitialized() returns ( bool ) {\\r\\n    getManagedToken = newManagedToken_;\\r\\n    getReserveToken = newReserveToken_;\\r\\n    isReserveToken[newReserveToken_] = true;\\r\\n    getBondingCalculator = newBondingCalculator_;\\r\\n    LPRewardsContract = newLPRewardsContract_;\\r\\n    isInitialized = true;\\r\\n    return true;\\r\\n  }\\r\\n\\r\\n  function setPrincipleToken( address newPrincipleToken_ ) external onlyOwner() returns ( bool ) {\\r\\n    getPrincipleToken = newPrincipleToken_;\\r\\n    isPrincipleToken[newPrincipleToken_] = true;\\r\\n    return true;\\r\\n  }\\r\\n\\r\\n  function setPrincipleDepositor( address newDepositor_ ) external onlyOwner() returns ( bool ) {\\r\\n    isPrincipleDepositor[newDepositor_] = true;\\r\\n    return true;\\r\\n  }\\r\\n\\r\\n  function setReserveDepositor( address newDepositor_ ) external onlyOwner() returns ( bool ) {\\r\\n    isReserveDepositor[newDepositor_] = true;\\r\\n    return true;\\r\\n  }\\r\\n\\r\\n  function removePrincipleDepositor( address depositor_ ) external onlyOwner() returns ( bool ) {\\r\\n    isPrincipleDepositor[depositor_] = false;\\r\\n    return true;\\r\\n  }\\r\\n\\r\\n  function removeReserveDepositor( address depositor_ ) external onlyOwner() returns ( bool ) {\\r\\n    isReserveDepositor[depositor_] = false;\\r\\n    return true;\\r\\n  }\\r\\n\\r\\n  function rewardsDepositPrinciple( uint depositAmount_ ) external returns ( bool ) {\\r\\n    require(isReserveDepositor[msg.sender] == true, \\\"Not allowed to deposit\\\");\\r\\n    address principleToken = getPrincipleToken;\\r\\n    IERC20( principleToken ).safeTransferFrom( msg.sender, address(this), depositAmount_ );\\r\\n    uint value = IBondingCalculator( getBondingCalculator ).principleValuation( principleToken, depositAmount_ ).div( 1e9 );\\r\\n    uint forLP = value.div( LPProfitShare );\\r\\n    IERC20Mintable( getManagedToken ).mint( stakingContract, value.sub( forLP ) );\\r\\n    IERC20Mintable( getManagedToken ).mint( LPRewardsContract, forLP );\\r\\n    return true;\\r\\n  }\\r\\n\\r\\n function depositReserves( uint amount_ ) external returns ( bool ) {\\r\\n    require(isReserveDepositor[msg.sender] == true, \\\"Not allowed to deposit\\\");\\r\\n    IERC20( getReserveToken ).safeTransferFrom( msg.sender, address(this), amount_ );\\r\\n    address managedToken_ = getManagedToken;\\r\\n    IERC20Mintable( managedToken_ ).mint( msg.sender, amount_.div( 10 ** IERC20( managedToken_ ).decimals() ) );\\r\\n    return true;\\r\\n  }\\r\\n\\r\\n  function depositPrinciple( uint depositAmount_ ) external returns ( bool ) {\\r\\n    require(isPrincipleDepositor[msg.sender] == true, \\\"Not allowed to deposit\\\");\\r\\n    address principleToken = getPrincipleToken;\\r\\n    IERC20( principleToken ).safeTransferFrom( msg.sender, address(this), depositAmount_ );\\r\\n    uint value = IBondingCalculator( getBondingCalculator ).principleValuation( principleToken, depositAmount_ ).div( 1e9 );\\r\\n    IERC20Mintable( getManagedToken ).mint( msg.sender, value );\\r\\n    return true;\\r\\n  }\\r\\n\\r\\n  function migrateReserveAndPrinciple() external onlyOwner() isTimelockExpired() returns ( bool saveGas_ ) {\\r\\n    IERC20( getReserveToken ).safeTransfer( daoWallet, IERC20( getReserveToken ).balanceOf( address( this ) ) );\\r\\n    IERC20( getPrincipleToken ).safeTransfer( daoWallet, IERC20( getPrincipleToken ).balanceOf( address( this ) ) );\\r\\n    return true;\\r\\n  }\\r\\n\\r\\n  function setTimelock( uint newTimelockDurationInBlocks_ ) external onlyOwner() notTimelockSet() returns ( bool ) {\\r\\n    timelockDurationInBlocks = newTimelockDurationInBlocks_;\\r\\n    return true;\\r\\n  }\\r\\n\\r\\n  function startTimelock() external onlyOwner() returns ( bool ) {\\r\\n    getTimelockEndBlock = block.number.add( timelockDurationInBlocks );\\r\\n    isTimelockSet = true;\\r\\n    emit TimelockStarted( getTimelockEndBlock );\\r\\n    return true;\\r\\n  }\\r\\n}\\r\\n\",\"keccak256\":\"0x75beab50a9df1bc2744286e1ba300a35e10c9d111e9cfb153cd306e312be019d\",\"license\":\"AGPL-3.0-or-later\"}},\"version\":1}",
  "bytecode": "0x608060405234801561001057600080fd5b50600080546001600160a01b03191633178082556040516001600160a01b039190911691907f8be0079c531659141344cd1fd0a4f28419497f9722a3daafe3b4186f6b6457e0908290a3611a2c806100696000396000f3fe608060405234801561001057600080fd5b506004361061021c5760003560e01c806376f9fa3d11610125578063d06c8b60116100ad578063ee99205c1161007c578063ee99205c146104fb578063f24e7ea214610503578063f2fde38b14610520578063f8c8765e14610546578063fde09c90146105845761021c565b8063d06c8b60146104bd578063e383fae8146104e3578063e594203d146104eb578063eb21c9fc146104f35761021c565b806394686123116100f4578063946861231461043b5780639dd373b914610461578063a5bec75614610487578063af1417d21461048f578063b29c7444146104b55761021c565b806376f9fa3d146103e85780637750446f146103f0578063792a660b1461040d5780638da5cb5b146104335761021c565b8063392e53cd116101a857806368c31dd51161017757806368c31dd514610382578063698a5897146103a85780636e4a00da146103b0578063702c5f8b146103b8578063715018a6146103de5761021c565b8063392e53cd1461032f57806344ce3d121461033757806354b6dced1461033f57806362884c0d1461035c5761021c565b80632200778f116101ef5780632200778f146102c25780632aee7ef8146102ca5780632c36b69c146102e457806330637d58146102ec578063332782b1146103095761021c565b80630b031d44146102215780630c76218a1461025b578063124154ca1461027f5780631e891c0a146102a5575b600080fd5b6102476004803603602081101561023757600080fd5b50356001600160a01b03166105aa565b604080519115158252519081900360200190f35b6102636105bf565b604080516001600160a01b039092168252519081900360200190f35b6102476004803603602081101561029557600080fd5b50356001600160a01b03166105ce565b610247600480360360208110156102bb57600080fd5b50356105e3565b61026361064a565b6102d2610659565b60408051918252519081900360200190f35b61024761065f565b6102476004803603602081101561030257600080fd5b5035610668565b6102476004803603602081101561031f57600080fd5b50356001600160a01b031661088c565b6102476108ff565b6102d261090f565b6102476004803603602081101561035557600080fd5b5035610915565b6102476004803603602081101561037257600080fd5b50356001600160a01b0316610a67565b6102476004803603602081101561039857600080fd5b50356001600160a01b0316610ada565b610263610aef565b6102d2610afe565b610247600480360360208110156103ce57600080fd5b50356001600160a01b0316610b04565b6103e6610b77565b005b610263610c0e565b6102476004803603602081101561040657600080fd5b5035610c1d565b6102476004803603602081101561042357600080fd5b50356001600160a01b0316610d8b565b610263610e02565b6102476004803603602081101561045157600080fd5b50356001600160a01b0316610e11565b6102476004803603602081101561047757600080fd5b50356001600160a01b0316610e9e565b6102d2610f11565b610247600480360360208110156104a557600080fd5b50356001600160a01b0316610f17565b610247610f2c565b610247600480360360208110156104d357600080fd5b50356001600160a01b0316610fd2565b610263611045565b610263611054565b610247611063565b61026361120d565b6102476004803603602081101561051957600080fd5b503561121c565b6103e66004803603602081101561053657600080fd5b50356001600160a01b0316611273565b6102476004803603608081101561055c57600080fd5b506001600160a01b038135811691602081013582169160408201358116916060013516611360565b6102476004803603602081101561059a57600080fd5b50356001600160a01b0316611449565b600f6020526000908152604090205460ff1681565b600b546001600160a01b031681565b60106020526000908152604090205460ff1681565b600080546001600160a01b03163314610631576040805162461bcd60e51b815260206004820181905260248201526000805160206119ad833981519152604482015290519081900360640190fd5b60025460ff161561064157600080fd5b50600190815590565b600c546001600160a01b031681565b60075481565b60025460ff1681565b3360009081526010602052604081205460ff1615156001146106ca576040805162461bcd60e51b8152602060048201526016602482015275139bdd08185b1b1bddd959081d1bc819195c1bdcda5d60521b604482015290519081900360640190fd5b600b546001600160a01b03166106e2813330866114c0565b600c546040805163fb452dc160e01b81526001600160a01b03848116600483015260248201879052915160009361077493633b9aca009391169163fb452dc191604480820192602092909190829003018186803b15801561074257600080fd5b505afa158015610756573d6000803e3d6000fd5b505050506040513d602081101561076c57600080fd5b505190611520565b9050600061078d6007548361152090919063ffffffff16565b6009546006549192506001600160a01b03908116916340c10f1991166107b38585611569565b6040518363ffffffff1660e01b815260040180836001600160a01b0316815260200182815260200192505050600060405180830381600087803b1580156107f957600080fd5b505af115801561080d573d6000803e3d6000fd5b5050600954600554604080516340c10f1960e01b81526001600160a01b0392831660048201526024810187905290519190921693506340c10f199250604480830192600092919082900301818387803b15801561086957600080fd5b505af115801561087d573d6000803e3d6000fd5b50600198975050505050505050565b600080546001600160a01b031633146108da576040805162461bcd60e51b815260206004820181905260248201526000805160206119ad833981519152604482015290519081900360640190fd5b506001600160a01b03166000908152601060205260409020805460ff19169055600190565b600054600160a01b900460ff1681565b60035481565b336000908152600f602052604081205460ff161515600114610977576040805162461bcd60e51b8152602060048201526016602482015275139bdd08185b1b1bddd959081d1bc819195c1bdcda5d60521b604482015290519081900360640190fd5b600b546001600160a01b031661098f813330866114c0565b600c546040805163fb452dc160e01b81526001600160a01b0384811660048301526024820187905291516000936109ef93633b9aca009391169163fb452dc191604480820192602092909190829003018186803b15801561074257600080fd5b600954604080516340c10f1960e01b81523360048201526024810184905290519293506001600160a01b03909116916340c10f199160448082019260009290919082900301818387803b158015610a4557600080fd5b505af1158015610a59573d6000803e3d6000fd5b506001979650505050505050565b600080546001600160a01b03163314610ab5576040805162461bcd60e51b815260206004820181905260248201526000805160206119ad833981519152604482015290519081900360640190fd5b506001600160a01b03166000908152600f60205260409020805460ff19169055600190565b600d6020526000908152604090205460ff1681565b6004546001600160a01b031681565b60085481565b600080546001600160a01b03163314610b52576040805162461bcd60e51b815260206004820181905260248201526000805160206119ad833981519152604482015290519081900360640190fd5b50600580546001600160a01b0383166001600160a01b03199091161790556001919050565b6000546001600160a01b03163314610bc4576040805162461bcd60e51b815260206004820181905260248201526000805160206119ad833981519152604482015290519081900360640190fd5b600080546040516001600160a01b03909116907f8be0079c531659141344cd1fd0a4f28419497f9722a3daafe3b4186f6b6457e0908390a3600080546001600160a01b0319169055565b6009546001600160a01b031681565b3360009081526010602052604081205460ff161515600114610c7f576040805162461bcd60e51b8152602060048201526016602482015275139bdd08185b1b1bddd959081d1bc819195c1bdcda5d60521b604482015290519081900360640190fd5b600a54610c97906001600160a01b03163330856114c0565b6009546040805163313ce56760e01b815290516001600160a01b039092169182916340c10f19913391610d2491859163313ce567916004808301926020929190829003018186803b158015610ceb57600080fd5b505afa158015610cff573d6000803e3d6000fd5b505050506040513d6020811015610d1557600080fd5b5051879060ff16600a0a611520565b6040518363ffffffff1660e01b815260040180836001600160a01b0316815260200182815260200192505050600060405180830381600087803b158015610d6a57600080fd5b505af1158015610d7e573d6000803e3d6000fd5b5060019695505050505050565b600080546001600160a01b03163314610dd9576040805162461bcd60e51b815260206004820181905260248201526000805160206119ad833981519152604482015290519081900360640190fd5b506001600160a01b03166000908152601060205260409020805460ff1916600190811790915590565b6000546001600160a01b031690565b600080546001600160a01b03163314610e5f576040805162461bcd60e51b815260206004820181905260248201526000805160206119ad833981519152604482015290519081900360640190fd5b50600b80546001600160a01b0319166001600160a01b039290921691821790556000908152600e60205260409020805460ff1916600190811790915590565b600080546001600160a01b03163314610eec576040805162461bcd60e51b815260206004820181905260248201526000805160206119ad833981519152604482015290519081900360640190fd5b50600680546001600160a01b0383166001600160a01b03199091161790556001919050565b60015481565b600e6020526000908152604090205460ff1681565b600080546001600160a01b03163314610f7a576040805162461bcd60e51b815260206004820181905260248201526000805160206119ad833981519152604482015290519081900360640190fd5b600154610f889043906115ab565b60038190556002805460ff1916600117905560408051918252517f416c1ad2b96c356f3bbd35431f86cce449ddbb4f8c3755ea9d2776b04c2e9c8f9181900360200190a150600190565b600080546001600160a01b03163314611020576040805162461bcd60e51b815260206004820181905260248201526000805160206119ad833981519152604482015290519081900360640190fd5b50600480546001600160a01b0383166001600160a01b03199091161790556001919050565b6005546001600160a01b031681565b600a546001600160a01b031681565b600080546001600160a01b031633146110b1576040805162461bcd60e51b815260206004820181905260248201526000805160206119ad833981519152604482015290519081900360640190fd5b6003546110bd57600080fd5b60025460ff166110cc57600080fd5b6003544310156110db57600080fd5b60048054600a54604080516370a0823160e01b8152309481019490945251611171936001600160a01b0393841693909216916370a08231916024808301926020929190829003018186803b15801561113257600080fd5b505afa158015611146573d6000803e3d6000fd5b505050506040513d602081101561115c57600080fd5b5051600a546001600160a01b03169190611605565b60048054600b54604080516370a0823160e01b8152309481019490945251611207936001600160a01b0393841693909216916370a08231916024808301926020929190829003018186803b1580156111c857600080fd5b505afa1580156111dc573d6000803e3d6000fd5b505050506040513d60208110156111f257600080fd5b5051600b546001600160a01b03169190611605565b50600190565b6006546001600160a01b031681565b600080546001600160a01b0316331461126a576040805162461bcd60e51b815260206004820181905260248201526000805160206119ad833981519152604482015290519081900360640190fd5b50600755600190565b6000546001600160a01b031633146112c0576040805162461bcd60e51b815260206004820181905260248201526000805160206119ad833981519152604482015290519081900360640190fd5b6001600160a01b0381166113055760405162461bcd60e51b81526004018080602001828103825260268152602001806119876026913960400191505060405180910390fd5b600080546040516001600160a01b03808516939216917f8be0079c531659141344cd1fd0a4f28419497f9722a3daafe3b4186f6b6457e091a3600080546001600160a01b0319166001600160a01b0392909216919091179055565b600080546001600160a01b031633146113ae576040805162461bcd60e51b815260206004820181905260248201526000805160206119ad833981519152604482015290519081900360640190fd5b600054600160a01b900460ff16156113c557600080fd5b50600980546001600160a01b038087166001600160a01b031992831617909255600a805486841690831681179091556000908152600d60205260408120805460ff19166001908117909155600c8054878616908516179055600580549486169490931693909317909155805460ff60a01b1916600160a01b1790555b949350505050565b600080546001600160a01b03163314611497576040805162461bcd60e51b815260206004820181905260248201526000805160206119ad833981519152604482015290519081900360640190fd5b506001600160a01b03166000908152600f60205260409020805460ff1916600190811790915590565b604080516001600160a01b0380861660248301528416604482015260648082018490528251808303909101815260849091019091526020810180516001600160e01b03166323b872dd60e01b17905261151a90859061165c565b50505050565b600061156283836040518060400160405280601a81526020017f536166654d6174683a206469766973696f6e206279207a65726f00000000000081525061170d565b9392505050565b600061156283836040518060400160405280601e81526020017f536166654d6174683a207375627472616374696f6e206f766572666c6f7700008152506117af565b600082820183811015611562576040805162461bcd60e51b815260206004820152601b60248201527f536166654d6174683a206164646974696f6e206f766572666c6f770000000000604482015290519081900360640190fd5b604080516001600160a01b038416602482015260448082018490528251808303909101815260649091019091526020810180516001600160e01b031663a9059cbb60e01b17905261165790849061165c565b505050565b60606116b1826040518060400160405280602081526020017f5361666545524332303a206c6f772d6c6576656c2063616c6c206661696c6564815250856001600160a01b03166118099092919063ffffffff16565b805190915015611657578080602001905160208110156116d057600080fd5b50516116575760405162461bcd60e51b815260040180806020018281038252602a8152602001806119cd602a913960400191505060405180910390fd5b600081836117995760405162461bcd60e51b81526004018080602001828103825283818151815260200191508051906020019080838360005b8381101561175e578181015183820152602001611746565b50505050905090810190601f16801561178b5780820380516001836020036101000a031916815260200191505b509250505060405180910390fd5b5060008385816117a557fe5b0495945050505050565b600081848411156118015760405162461bcd60e51b815260206004820181815283516024840152835190928392604490910191908501908083836000831561175e578181015183820152602001611746565b505050900390565b60606114418484600085606061181e85611980565b61186f576040805162461bcd60e51b815260206004820152601d60248201527f416464726573733a2063616c6c20746f206e6f6e2d636f6e7472616374000000604482015290519081900360640190fd5b60006060866001600160a01b031685876040518082805190602001908083835b602083106118ae5780518252601f19909201916020918201910161188f565b6001836020036101000a03801982511681845116808217855250505050505090500191505060006040518083038185875af1925050503d8060008114611910576040519150601f19603f3d011682016040523d82523d6000602084013e611915565b606091505b509150915081156119295791506114419050565b8051156119395780518082602001fd5b60405162461bcd60e51b815260206004820181815286516024840152865187939192839260440191908501908083836000831561175e578181015183820152602001611746565b3b15159056fe4f776e61626c653a206e6577206f776e657220697320746865207a65726f20616464726573734f776e61626c653a2063616c6c6572206973206e6f7420746865206f776e65725361666545524332303a204552433230206f7065726174696f6e20646964206e6f742073756363656564a2646970667358221220bccd156e624211604e24d3309fc52a80117e0c965bedf077ee7da507b53a312064736f6c63430007050033",
  "deployedBytecode": "0x608060405234801561001057600080fd5b506004361061021c5760003560e01c806376f9fa3d11610125578063d06c8b60116100ad578063ee99205c1161007c578063ee99205c146104fb578063f24e7ea214610503578063f2fde38b14610520578063f8c8765e14610546578063fde09c90146105845761021c565b8063d06c8b60146104bd578063e383fae8146104e3578063e594203d146104eb578063eb21c9fc146104f35761021c565b806394686123116100f4578063946861231461043b5780639dd373b914610461578063a5bec75614610487578063af1417d21461048f578063b29c7444146104b55761021c565b806376f9fa3d146103e85780637750446f146103f0578063792a660b1461040d5780638da5cb5b146104335761021c565b8063392e53cd116101a857806368c31dd51161017757806368c31dd514610382578063698a5897146103a85780636e4a00da146103b0578063702c5f8b146103b8578063715018a6146103de5761021c565b8063392e53cd1461032f57806344ce3d121461033757806354b6dced1461033f57806362884c0d1461035c5761021c565b80632200778f116101ef5780632200778f146102c25780632aee7ef8146102ca5780632c36b69c146102e457806330637d58146102ec578063332782b1146103095761021c565b80630b031d44146102215780630c76218a1461025b578063124154ca1461027f5780631e891c0a146102a5575b600080fd5b6102476004803603602081101561023757600080fd5b50356001600160a01b03166105aa565b604080519115158252519081900360200190f35b6102636105bf565b604080516001600160a01b039092168252519081900360200190f35b6102476004803603602081101561029557600080fd5b50356001600160a01b03166105ce565b610247600480360360208110156102bb57600080fd5b50356105e3565b61026361064a565b6102d2610659565b60408051918252519081900360200190f35b61024761065f565b6102476004803603602081101561030257600080fd5b5035610668565b6102476004803603602081101561031f57600080fd5b50356001600160a01b031661088c565b6102476108ff565b6102d261090f565b6102476004803603602081101561035557600080fd5b5035610915565b6102476004803603602081101561037257600080fd5b50356001600160a01b0316610a67565b6102476004803603602081101561039857600080fd5b50356001600160a01b0316610ada565b610263610aef565b6102d2610afe565b610247600480360360208110156103ce57600080fd5b50356001600160a01b0316610b04565b6103e6610b77565b005b610263610c0e565b6102476004803603602081101561040657600080fd5b5035610c1d565b6102476004803603602081101561042357600080fd5b50356001600160a01b0316610d8b565b610263610e02565b6102476004803603602081101561045157600080fd5b50356001600160a01b0316610e11565b6102476004803603602081101561047757600080fd5b50356001600160a01b0316610e9e565b6102d2610f11565b610247600480360360208110156104a557600080fd5b50356001600160a01b0316610f17565b610247610f2c565b610247600480360360208110156104d357600080fd5b50356001600160a01b0316610fd2565b610263611045565b610263611054565b610247611063565b61026361120d565b6102476004803603602081101561051957600080fd5b503561121c565b6103e66004803603602081101561053657600080fd5b50356001600160a01b0316611273565b6102476004803603608081101561055c57600080fd5b506001600160a01b038135811691602081013582169160408201358116916060013516611360565b6102476004803603602081101561059a57600080fd5b50356001600160a01b0316611449565b600f6020526000908152604090205460ff1681565b600b546001600160a01b031681565b60106020526000908152604090205460ff1681565b600080546001600160a01b03163314610631576040805162461bcd60e51b815260206004820181905260248201526000805160206119ad833981519152604482015290519081900360640190fd5b60025460ff161561064157600080fd5b50600190815590565b600c546001600160a01b031681565b60075481565b60025460ff1681565b3360009081526010602052604081205460ff1615156001146106ca576040805162461bcd60e51b8152602060048201526016602482015275139bdd08185b1b1bddd959081d1bc819195c1bdcda5d60521b604482015290519081900360640190fd5b600b546001600160a01b03166106e2813330866114c0565b600c546040805163fb452dc160e01b81526001600160a01b03848116600483015260248201879052915160009361077493633b9aca009391169163fb452dc191604480820192602092909190829003018186803b15801561074257600080fd5b505afa158015610756573d6000803e3d6000fd5b505050506040513d602081101561076c57600080fd5b505190611520565b9050600061078d6007548361152090919063ffffffff16565b6009546006549192506001600160a01b03908116916340c10f1991166107b38585611569565b6040518363ffffffff1660e01b815260040180836001600160a01b0316815260200182815260200192505050600060405180830381600087803b1580156107f957600080fd5b505af115801561080d573d6000803e3d6000fd5b5050600954600554604080516340c10f1960e01b81526001600160a01b0392831660048201526024810187905290519190921693506340c10f199250604480830192600092919082900301818387803b15801561086957600080fd5b505af115801561087d573d6000803e3d6000fd5b50600198975050505050505050565b600080546001600160a01b031633146108da576040805162461bcd60e51b815260206004820181905260248201526000805160206119ad833981519152604482015290519081900360640190fd5b506001600160a01b03166000908152601060205260409020805460ff19169055600190565b600054600160a01b900460ff1681565b60035481565b336000908152600f602052604081205460ff161515600114610977576040805162461bcd60e51b8152602060048201526016602482015275139bdd08185b1b1bddd959081d1bc819195c1bdcda5d60521b604482015290519081900360640190fd5b600b546001600160a01b031661098f813330866114c0565b600c546040805163fb452dc160e01b81526001600160a01b0384811660048301526024820187905291516000936109ef93633b9aca009391169163fb452dc191604480820192602092909190829003018186803b15801561074257600080fd5b600954604080516340c10f1960e01b81523360048201526024810184905290519293506001600160a01b03909116916340c10f199160448082019260009290919082900301818387803b158015610a4557600080fd5b505af1158015610a59573d6000803e3d6000fd5b506001979650505050505050565b600080546001600160a01b03163314610ab5576040805162461bcd60e51b815260206004820181905260248201526000805160206119ad833981519152604482015290519081900360640190fd5b506001600160a01b03166000908152600f60205260409020805460ff19169055600190565b600d6020526000908152604090205460ff1681565b6004546001600160a01b031681565b60085481565b600080546001600160a01b03163314610b52576040805162461bcd60e51b815260206004820181905260248201526000805160206119ad833981519152604482015290519081900360640190fd5b50600580546001600160a01b0383166001600160a01b03199091161790556001919050565b6000546001600160a01b03163314610bc4576040805162461bcd60e51b815260206004820181905260248201526000805160206119ad833981519152604482015290519081900360640190fd5b600080546040516001600160a01b03909116907f8be0079c531659141344cd1fd0a4f28419497f9722a3daafe3b4186f6b6457e0908390a3600080546001600160a01b0319169055565b6009546001600160a01b031681565b3360009081526010602052604081205460ff161515600114610c7f576040805162461bcd60e51b8152602060048201526016602482015275139bdd08185b1b1bddd959081d1bc819195c1bdcda5d60521b604482015290519081900360640190fd5b600a54610c97906001600160a01b03163330856114c0565b6009546040805163313ce56760e01b815290516001600160a01b039092169182916340c10f19913391610d2491859163313ce567916004808301926020929190829003018186803b158015610ceb57600080fd5b505afa158015610cff573d6000803e3d6000fd5b505050506040513d6020811015610d1557600080fd5b5051879060ff16600a0a611520565b6040518363ffffffff1660e01b815260040180836001600160a01b0316815260200182815260200192505050600060405180830381600087803b158015610d6a57600080fd5b505af1158015610d7e573d6000803e3d6000fd5b5060019695505050505050565b600080546001600160a01b03163314610dd9576040805162461bcd60e51b815260206004820181905260248201526000805160206119ad833981519152604482015290519081900360640190fd5b506001600160a01b03166000908152601060205260409020805460ff1916600190811790915590565b6000546001600160a01b031690565b600080546001600160a01b03163314610e5f576040805162461bcd60e51b815260206004820181905260248201526000805160206119ad833981519152604482015290519081900360640190fd5b50600b80546001600160a01b0319166001600160a01b039290921691821790556000908152600e60205260409020805460ff1916600190811790915590565b600080546001600160a01b03163314610eec576040805162461bcd60e51b815260206004820181905260248201526000805160206119ad833981519152604482015290519081900360640190fd5b50600680546001600160a01b0383166001600160a01b03199091161790556001919050565b60015481565b600e6020526000908152604090205460ff1681565b600080546001600160a01b03163314610f7a576040805162461bcd60e51b815260206004820181905260248201526000805160206119ad833981519152604482015290519081900360640190fd5b600154610f889043906115ab565b60038190556002805460ff1916600117905560408051918252517f416c1ad2b96c356f3bbd35431f86cce449ddbb4f8c3755ea9d2776b04c2e9c8f9181900360200190a150600190565b600080546001600160a01b03163314611020576040805162461bcd60e51b815260206004820181905260248201526000805160206119ad833981519152604482015290519081900360640190fd5b50600480546001600160a01b0383166001600160a01b03199091161790556001919050565b6005546001600160a01b031681565b600a546001600160a01b031681565b600080546001600160a01b031633146110b1576040805162461bcd60e51b815260206004820181905260248201526000805160206119ad833981519152604482015290519081900360640190fd5b6003546110bd57600080fd5b60025460ff166110cc57600080fd5b6003544310156110db57600080fd5b60048054600a54604080516370a0823160e01b8152309481019490945251611171936001600160a01b0393841693909216916370a08231916024808301926020929190829003018186803b15801561113257600080fd5b505afa158015611146573d6000803e3d6000fd5b505050506040513d602081101561115c57600080fd5b5051600a546001600160a01b03169190611605565b60048054600b54604080516370a0823160e01b8152309481019490945251611207936001600160a01b0393841693909216916370a08231916024808301926020929190829003018186803b1580156111c857600080fd5b505afa1580156111dc573d6000803e3d6000fd5b505050506040513d60208110156111f257600080fd5b5051600b546001600160a01b03169190611605565b50600190565b6006546001600160a01b031681565b600080546001600160a01b0316331461126a576040805162461bcd60e51b815260206004820181905260248201526000805160206119ad833981519152604482015290519081900360640190fd5b50600755600190565b6000546001600160a01b031633146112c0576040805162461bcd60e51b815260206004820181905260248201526000805160206119ad833981519152604482015290519081900360640190fd5b6001600160a01b0381166113055760405162461bcd60e51b81526004018080602001828103825260268152602001806119876026913960400191505060405180910390fd5b600080546040516001600160a01b03808516939216917f8be0079c531659141344cd1fd0a4f28419497f9722a3daafe3b4186f6b6457e091a3600080546001600160a01b0319166001600160a01b0392909216919091179055565b600080546001600160a01b031633146113ae576040805162461bcd60e51b815260206004820181905260248201526000805160206119ad833981519152604482015290519081900360640190fd5b600054600160a01b900460ff16156113c557600080fd5b50600980546001600160a01b038087166001600160a01b031992831617909255600a805486841690831681179091556000908152600d60205260408120805460ff19166001908117909155600c8054878616908516179055600580549486169490931693909317909155805460ff60a01b1916600160a01b1790555b949350505050565b600080546001600160a01b03163314611497576040805162461bcd60e51b815260206004820181905260248201526000805160206119ad833981519152604482015290519081900360640190fd5b506001600160a01b03166000908152600f60205260409020805460ff1916600190811790915590565b604080516001600160a01b0380861660248301528416604482015260648082018490528251808303909101815260849091019091526020810180516001600160e01b03166323b872dd60e01b17905261151a90859061165c565b50505050565b600061156283836040518060400160405280601a81526020017f536166654d6174683a206469766973696f6e206279207a65726f00000000000081525061170d565b9392505050565b600061156283836040518060400160405280601e81526020017f536166654d6174683a207375627472616374696f6e206f766572666c6f7700008152506117af565b600082820183811015611562576040805162461bcd60e51b815260206004820152601b60248201527f536166654d6174683a206164646974696f6e206f766572666c6f770000000000604482015290519081900360640190fd5b604080516001600160a01b038416602482015260448082018490528251808303909101815260649091019091526020810180516001600160e01b031663a9059cbb60e01b17905261165790849061165c565b505050565b60606116b1826040518060400160405280602081526020017f5361666545524332303a206c6f772d6c6576656c2063616c6c206661696c6564815250856001600160a01b03166118099092919063ffffffff16565b805190915015611657578080602001905160208110156116d057600080fd5b50516116575760405162461bcd60e51b815260040180806020018281038252602a8152602001806119cd602a913960400191505060405180910390fd5b600081836117995760405162461bcd60e51b81526004018080602001828103825283818151815260200191508051906020019080838360005b8381101561175e578181015183820152602001611746565b50505050905090810190601f16801561178b5780820380516001836020036101000a031916815260200191505b509250505060405180910390fd5b5060008385816117a557fe5b0495945050505050565b600081848411156118015760405162461bcd60e51b815260206004820181815283516024840152835190928392604490910191908501908083836000831561175e578181015183820152602001611746565b505050900390565b60606114418484600085606061181e85611980565b61186f576040805162461bcd60e51b815260206004820152601d60248201527f416464726573733a2063616c6c20746f206e6f6e2d636f6e7472616374000000604482015290519081900360640190fd5b60006060866001600160a01b031685876040518082805190602001908083835b602083106118ae5780518252601f19909201916020918201910161188f565b6001836020036101000a03801982511681845116808217855250505050505090500191505060006040518083038185875af1925050503d8060008114611910576040519150601f19603f3d011682016040523d82523d6000602084013e611915565b606091505b509150915081156119295791506114419050565b8051156119395780518082602001fd5b60405162461bcd60e51b815260206004820181815286516024840152865187939192839260440191908501908083836000831561175e578181015183820152602001611746565b3b15159056fe4f776e61626c653a206e6577206f776e657220697320746865207a65726f20616464726573734f776e61626c653a2063616c6c6572206973206e6f7420746865206f776e65725361666545524332303a204552433230206f7065726174696f6e20646964206e6f742073756363656564a2646970667358221220bccd156e624211604e24d3309fc52a80117e0c965bedf077ee7da507b53a312064736f6c63430007050033",
  "devdoc": {
    "kind": "dev",
    "methods": {},
    "version": 1
  },
  "userdoc": {
    "kind": "user",
    "methods": {},
    "version": 1
  },
  "storageLayout": {
    "storage": [
      {
        "astId": 466,
        "contract": "contracts/Vault.sol:Vault",
        "label": "_owner",
        "offset": 0,
        "slot": "0",
        "type": "t_address"
      },
      {
        "astId": 763,
        "contract": "contracts/Vault.sol:Vault",
        "label": "isInitialized",
        "offset": 20,
        "slot": "0",
        "type": "t_bool"
      },
      {
        "astId": 765,
        "contract": "contracts/Vault.sol:Vault",
        "label": "timelockDurationInBlocks",
        "offset": 0,
        "slot": "1",
        "type": "t_uint256"
      },
      {
        "astId": 767,
        "contract": "contracts/Vault.sol:Vault",
        "label": "isTimelockSet",
        "offset": 0,
        "slot": "2",
        "type": "t_bool"
      },
      {
        "astId": 770,
        "contract": "contracts/Vault.sol:Vault",
        "label": "getTimelockEndBlock",
        "offset": 0,
        "slot": "3",
        "type": "t_uint256"
      },
      {
        "astId": 772,
        "contract": "contracts/Vault.sol:Vault",
        "label": "daoWallet",
        "offset": 0,
        "slot": "4",
        "type": "t_address"
      },
      {
        "astId": 774,
        "contract": "contracts/Vault.sol:Vault",
        "label": "LPRewardsContract",
        "offset": 0,
        "slot": "5",
        "type": "t_address"
      },
      {
        "astId": 776,
        "contract": "contracts/Vault.sol:Vault",
        "label": "stakingContract",
        "offset": 0,
        "slot": "6",
        "type": "t_address"
      },
      {
        "astId": 778,
        "contract": "contracts/Vault.sol:Vault",
        "label": "LPProfitShare",
        "offset": 0,
        "slot": "7",
        "type": "t_uint256"
      },
      {
        "astId": 780,
        "contract": "contracts/Vault.sol:Vault",
        "label": "getPrincipleTokenBalance",
        "offset": 0,
        "slot": "8",
        "type": "t_uint256"
      },
      {
        "astId": 783,
        "contract": "contracts/Vault.sol:Vault",
        "label": "getManagedToken",
        "offset": 0,
        "slot": "9",
        "type": "t_address"
      },
      {
        "astId": 785,
        "contract": "contracts/Vault.sol:Vault",
        "label": "getReserveToken",
        "offset": 0,
        "slot": "10",
        "type": "t_address"
      },
      {
        "astId": 787,
        "contract": "contracts/Vault.sol:Vault",
        "label": "getPrincipleToken",
        "offset": 0,
        "slot": "11",
        "type": "t_address"
      },
      {
        "astId": 790,
        "contract": "contracts/Vault.sol:Vault",
        "label": "getBondingCalculator",
        "offset": 0,
        "slot": "12",
        "type": "t_address"
      },
      {
        "astId": 794,
        "contract": "contracts/Vault.sol:Vault",
        "label": "isReserveToken",
        "offset": 0,
        "slot": "13",
        "type": "t_mapping(t_address,t_bool)"
      },
      {
        "astId": 798,
        "contract": "contracts/Vault.sol:Vault",
        "label": "isPrincipleToken",
        "offset": 0,
        "slot": "14",
        "type": "t_mapping(t_address,t_bool)"
      },
      {
        "astId": 802,
        "contract": "contracts/Vault.sol:Vault",
        "label": "isPrincipleDepositor",
        "offset": 0,
        "slot": "15",
        "type": "t_mapping(t_address,t_bool)"
      },
      {
        "astId": 806,
        "contract": "contracts/Vault.sol:Vault",
        "label": "isReserveDepositor",
        "offset": 0,
        "slot": "16",
        "type": "t_mapping(t_address,t_bool)"
      }
    ],
    "types": {
      "t_address": {
        "encoding": "inplace",
        "label": "address",
        "numberOfBytes": "20"
      },
      "t_bool": {
        "encoding": "inplace",
        "label": "bool",
        "numberOfBytes": "1"
      },
      "t_mapping(t_address,t_bool)": {
        "encoding": "mapping",
        "key": "t_address",
        "label": "mapping(address => bool)",
        "numberOfBytes": "32",
        "value": "t_bool"
      },
      "t_uint256": {
        "encoding": "inplace",
        "label": "uint256",
        "numberOfBytes": "32"
      }
    }
  }
}